Title,Content,user_id
"The Power of Gratitude","Gratitude is a superpower that can transform your life. Take a moment each day to appreciate the little things, and you'll be amazed at the positive impact it has on your well-being. #Gratitude #PositiveVibes",832
"Embrace Change and Grow","Change can be intimidating, but it's essential for personal growth. Embrace new opportunities, step out of your comfort zone, and watch yourself flourish into a better version of yourself. #EmbraceChange #PersonalGrowth",127
"Small Acts of Kindness Matter","Kindness costs nothing but has the power to change everything. A simple smile, a helping hand, or a kind word can brighten someone's day and create a ripple effect of positivity. Spread kindness today! #KindnessMatters #SpreadPositivity",549
"The Joy of Learning","Learning is a lifelong adventure that fuels personal and professional growth. Embrace curiosity, explore new subjects, and never stop seeking knowledge. The joy of learning knows no bounds! #NeverStopLearning #Curiosity",345
"Find Your Inner Peace","In the chaos of life, it's crucial to find moments of peace and tranquility. Whether it's through meditation, nature walks, or creative pursuits, prioritize your well-being and nurture your inner peace. #InnerPeace #SelfCare",781
"Dream Big, Take Action","Dreams without action are merely fantasies. Believe in yourself, set ambitious goals, and take consistent steps towards achieving them. You have the power to turn your dreams into reality! #DreamBig #TakeAction",456
"Celebrate Your Wins","Don't forget to celebrate your victories, no matter how small they may seem. Each accomplishment brings you closer to your goals and deserves recognition. Take a moment to appreciate your progress! #CelebrateWins #Achievements",234
"Embracing Failure as a Stepping Stone","Failure is not the end; it's a stepping stone to success. Every setback is an opportunity to learn, grow, and become stronger. Embrace failure, analyze it, and use it as fuel to keep moving forward! #EmbraceFailure #GrowthMindset",876
"The Magic of Self-Reflection","Self-reflection is a powerful tool for personal development. Set aside time regularly to introspect, evaluate your choices, and align yourself with your values. Discover the magic of self-awareness! #SelfReflection #PersonalDevelopment",912
"Spreading Love and Positivity","In a world that sometimes feels divided, let's remember the power of love and positivity. Be kind, empathetic, and compassionate towards others. Together, we can create a brighter and more harmonious world! #SpreadLove #Positivity",543
